,text,author_id,created_at,id
0,RT @shah_sheikh: Apple fixes the sixth zero-day since the beginning of 2022: Apple released security updates to address a zero-day bug acti…,313956192,2022-05-16T20:34:02.000Z,1526299961029033984
1,"Apple fixes the sixth zero-day since the beginning of 2022: Apple released security updates to address a zero-day bug actively exploited in attacks against Macs and Apple Watch devices. Apple has addressed a zero-day vulnerability, tracked as… https://t.co/w7aBIYMphh",340491651,2022-05-16T20:33:33.000Z,1526299836911214592
2,"the most dangerous vulnerability (CVE-2022-26925) scores CVSS8.1 however jumps to 9.8 when this vulnerability is used in NTLM Relay attacks on Active Directory Certificate Services, as it could allow an attacker to authenticate on a domain controller. https://t.co/FH8qSGkIpK",748666839593418752,2022-05-12T06:48:42.000Z,1524642707062366212
3,"Critical F5 BIG-IP vulnerability targeted by destructive attacks. F5 customers using BIG-IP solutions include governments, Fortune 500 firms, banks, service providers, and consumer brands (e.g. Microsoft, Oracle, and Facebook). https://t.co/lXf7Fm3Atx",324735638,2022-05-11T14:53:48.000Z,1524402397577027584
4,RT @PAUL_CSFI: Attacks and Breaches What to Patch Now: Actively Exploited Windows Zero-Day Threatens Domain Controllers https://t.co/n75ie8…,63619129,2022-05-11T01:14:55.000Z,1524196320118022145
5,Attacks and Breaches What to Patch Now: Actively Exploited Windows Zero-Day Threatens Domain Controllers https://t.co/n75ie8r4C9,175238853,2022-05-10T22:49:50.000Z,1524159807342657537
